question_id,short_answer_id,short_answer_text,five_word_answer_id,five_word_answer_text,short_answer_rating_id,five_word_answer_rating_id,short_answer_rating_score,five_word_answer_rating_score,short_answer_rating_rationale,five_word_answer_rating_rationale,short_answer_length
73341,2193264,Long-range marksmanship capability.,2193267,Long-range marksmanship capability.,2193059,2193061,5,5,"The answer ""Long-range marksmanship capability"" accurately identifies the primary advantage that the American rifle units brought to the battlefield during the American Revolutionary War. This is explicitly stated in the passage, which notes that the rifle units ""complemented the predominant, musket-equipped, line infantry forces of the war with their long-range marksmanship capability"". The passage provides context for why this capability was important, explaining that it allowed the rifle units to be deployed as forward skirmishers and flanking elements, and to respond adaptably to changing battle conditions. The answer is fully accurate and detailed, providing a clear and comprehensive response to the question.","The answer ""Long-range marksmanship capability"" accurately identifies the primary advantage that the American rifle units brought to the battlefield during the American Revolutionary War. This is explicitly stated in the passage, which notes that the rifle units ""complemented the predominant, musket-equipped, line infantry forces of the war with their long-range marksmanship capability"". The passage provides context for why this capability was important, explaining that it allowed the rifle units to be deployed as forward skirmishers and flanking elements, and to respond adaptably to changing battle conditions. The answer is fully accurate and detailed, providing a clear and comprehensive response to the question.",3
73337,2193197,Philadelphia Liberty Medal.,2193200,Philadelphia Liberty Medal.,2192991,2192994,5,5,"The answer ""Philadelphia Liberty Medal"" is a fully accurate and detailed response to the question. It directly quotes the information provided in the original text, which states that Malala Yousafzai received the Philadelphia Liberty Medal in 2014. The answer is concise, clear, and comprehensive, providing the exact information requested without any errors or omissions. There is no need for additional detail or clarification, making it a perfect match with the question. Therefore, I rate this answer as a 5, indicating that it is fully accurate and detailed.","The answer ""Philadelphia Liberty Medal"" is a fully accurate and detailed response to the question. It directly quotes the information provided in the original text, which states that Malala Yousafzai received the Philadelphia Liberty Medal in 2014. The answer is concise, clear, and comprehensive, providing the exact information requested without any errors or omissions. There is no need for additional detail or clarification, making it a perfect match with the question. Therefore, I rate this answer as a 5, indicating that it is fully accurate and detailed.",3
73180,2192754,Smoking cessation.,2192756,Smoking cessation treatment.,2192548,2192553,5,5,"The answer ""Smoking cessation"" is a fully accurate and detailed response to the question. It directly quotes the original text, which states that ""Suicidal behavior is less of a concern when bupropion is prescribed for smoking cessation."" The answer provides a clear and concise response that accurately summarizes the information provided in the original text, making it a 5 out of 5. There are no errors, omissions, or inaccuracies in the answer, and it provides all the necessary information to fully address the question.","The answer ""Smoking cessation treatment"" is a fully accurate and detailed response to the question. It directly quotes the original text, which states that ""Suicidal behavior is less of a concern when bupropion is prescribed for smoking cessation."" The answer provides a clear and concise response that accurately summarizes the information provided in the original text, making it a 5 out of 5. There are no errors, omissions, or inaccuracies in the answer, and it provides all the necessary information to fully address the question.",2
73077,2192717,HMS Pegasus.,2192718,HMS Pegasus.,2192510,2192515,5,5,"The answer ""HMS Pegasus"" is fully accurate and detailed. It directly quotes the information provided in the original text, which states that SMS Königsberg ""surprised and sank the British protected cruiser HMS Pegasus in the Battle of Zanzibar"" on 20 September 1914. The answer provides the exact name of the British ship sunk by SMS Königsberg, which is the specific information requested in the question. There are no errors, omissions, or inaccuracies in the answer, making it a fully accurate and comprehensive response.","The answer ""HMS Pegasus"" is fully accurate and detailed. It directly quotes the information provided in the original text, which states that SMS Königsberg ""surprised and sank the British protected cruiser HMS Pegasus in the Battle of Zanzibar"" on 20 September 1914. The answer provides the exact name of the British ship sunk by SMS Königsberg, which is the specific information requested in the question. There are no errors, omissions, or inaccuracies in the answer, making it a fully accurate and comprehensive response.",2
73334,2193159,Bleak and inhospitable.,2193160,Bleak and inhospitable.,2192952,2192957,5,5,"The answer ""Bleak and inhospitable"" is a fully accurate and detailed response to the question. It directly quotes the description provided in the original text, which states that the climate of Minnesota is portrayed as ""bleak and inhospitable"" in the 1996 film Fargo. The answer is concise, clear, and comprehensive, providing exactly the information requested by the question without any errors or omissions. Therefore, it deserves a perfect score of 5.","The answer ""Bleak and inhospitable"" is a fully accurate and detailed response to the question. It directly quotes the description provided in the original text, which states that the climate of Minnesota is portrayed as ""bleak and inhospitable"" in the 1996 film Fargo. The answer is concise, clear, and comprehensive, providing exactly the information requested by the question without any errors or omissions. Therefore, it deserves a perfect score of 5.",3
